{
	"id": "9c3e4f51-6d7f-4081-9cad-1e2f3a4b5c62",
	"organizationId": "0f4b2c6d-8e1a-4b3c-9d5e-6f7a8b9c0d12",
	"version": 2,
	"createdAt": "2026-10-17T08:00:00.000Z",
	"updatedAt": "2026-10-17T08:00:05.000Z",
	"ownerUserId": "2b6d4e8f-0a3c-4d5e-9f71-8b9c0d1e2f30",
	"agentId": "3c7e5f90-1b4d-4e6f-8a82-9c0d1e2f3a41",
	"taskId": "5e907b12-3d6f-4081-8ca4-1e2f3a4b5c63",
	"conversationId": null,
	"direction": "inbound",
	"status": "received",
	"deliveryStatus": "delivered",
	"from": "ada@example.com",
	"to": ["support.acme@inbox.gauzy.co"],
	"cc": [],
	"subject": "Refund for order 1042",
	"text": "Hi, can I get a refund for order 1042?",
	"html": null,
	"messageId": "CAF1x2y3@mail.example.com",
	"inReplyTo": null,
	"references": [],
	"attachments": [],
	"sentAt": null,
	"receivedAt": "2026-10-17T08:00:00.000Z",
	"webUrl": "https://app.ever.works/agents/3c7e5f90-1b4d-4e6f-8a82-9c0d1e2f3a41/inbox/9c3e4f51-6d7f-4081-9cad-1e2f3a4b5c62"
}
